{
  "schema_version": 1,
  "generator_version": "chapter-templates-v1",
  "source_commit": "a04446e57ec1fbc252a871afcec7752fb2807b14",
  "chapter": "desirables",
  "chapter_ordinal": 113,
  "source_title": "Desirables",
  "source_file": "desirables.tex",
  "source_sha256": "sha256:f0bb3c9534d8ecb44cfbb0023cbda8524dfdf161b03b78ea928430af6d0addc3",
  "source_state": "CURRENT",
  "sections": [
    {
      "ordinal": 1,
      "source_title": "Introduction",
      "source_label": "desirables-section-introduction",
      "parent_tag": "02B5",
      "suggested_batch": "desirables-02B5",
      "suggested_unit_file": "translation-data/units/desirables-02B5.jsonl",
      "unit_files": [
        "translation-data/units/desirables-02B5.jsonl"
      ],
      "state": "READY"
    },
    {
      "ordinal": 2,
      "source_title": "Conventions",
      "source_label": "desirables-section-conventions",
      "parent_tag": "02B7",
      "suggested_batch": "desirables-02B7",
      "suggested_unit_file": "translation-data/units/desirables-02B7.jsonl",
      "unit_files": [],
      "state": "UNPREPARED"
    },
    {
      "ordinal": 3,
      "source_title": "Sites and Topoi",
      "source_label": "desirables-section-sites",
      "parent_tag": "02BA",
      "suggested_batch": "desirables-02BA",
      "suggested_unit_file": "translation-data/units/desirables-02BA.jsonl",
      "unit_files": [],
      "state": "UNPREPARED"
    },
    {
      "ordinal": 4,
      "source_title": "Stacks",
      "source_label": "desirables-section-stacks",
      "parent_tag": "02BB",
      "suggested_batch": "desirables-02BB",
      "suggested_unit_file": "translation-data/units/desirables-02BB.jsonl",
      "unit_files": [],
      "state": "UNPREPARED"
    },
    {
      "ordinal": 5,
      "source_title": "Simplicial methods",
      "source_label": "desirables-section-simplicial",
      "parent_tag": "03MZ",
      "suggested_batch": "desirables-03MZ",
      "suggested_unit_file": "translation-data/units/desirables-03MZ.jsonl",
      "unit_files": [],
      "state": "UNPREPARED"
    },
    {
      "ordinal": 6,
      "source_title": "Cohomology of schemes",
      "source_label": "desirables-section-schemes-cohomology",
      "parent_tag": "02BE",
      "suggested_batch": "desirables-02BE",
      "suggested_unit_file": "translation-data/units/desirables-02BE.jsonl",
      "unit_files": [],
      "state": "UNPREPARED"
    },
    {
      "ordinal": 7,
      "source_title": "Deformation theory \\`a la Schlessinger",
      "source_label": "desirables-section-deformation-schlessinger",
      "parent_tag": "02BF",
      "suggested_batch": "desirables-02BF",
      "suggested_unit_file": "translation-data/units/desirables-02BF.jsonl",
      "unit_files": [],
      "state": "UNPREPARED"
    },
    {
      "ordinal": 8,
      "source_title": "Definition of algebraic stacks",
      "source_label": "desirables-section-definition-algebraic-stacks",
      "parent_tag": "02BK",
      "suggested_batch": "desirables-02BK",
      "suggested_unit_file": "translation-data/units/desirables-02BK.jsonl",
      "unit_files": [],
      "state": "UNPREPARED"
    },
    {
      "ordinal": 9,
      "source_title": "Examples of schemes, algebraic spaces, algebraic stacks",
      "source_label": "desirables-section-examples-stacks",
      "parent_tag": "02BL",
      "suggested_batch": "desirables-02BL",
      "suggested_unit_file": "translation-data/units/desirables-02BL.jsonl",
      "unit_files": [],
      "state": "UNPREPARED"
    },
    {
      "ordinal": 10,
      "source_title": "Properties of algebraic stacks",
      "source_label": "desirables-section-stacks-properties",
      "parent_tag": "02BM",
      "suggested_batch": "desirables-02BM",
      "suggested_unit_file": "translation-data/units/desirables-02BM.jsonl",
      "unit_files": [],
      "state": "UNPREPARED"
    },
    {
      "ordinal": 11,
      "source_title": "Lisse \\'etale site of an algebraic stack",
      "source_label": "desirables-section-lisse-etale",
      "parent_tag": "02BN",
      "suggested_batch": "desirables-02BN",
      "suggested_unit_file": "translation-data/units/desirables-02BN.jsonl",
      "unit_files": [],
      "state": "UNPREPARED"
    },
    {
      "ordinal": 12,
      "source_title": "Things you always wanted to know but were afraid to ask",
      "source_label": "desirables-section-stacks-fun-lemmas",
      "parent_tag": "02BO",
      "suggested_batch": "desirables-02BO",
      "suggested_unit_file": "translation-data/units/desirables-02BO.jsonl",
      "unit_files": [],
      "state": "UNPREPARED"
    },
    {
      "ordinal": 13,
      "source_title": "Quasi-coherent sheaves on stacks",
      "source_label": "desirables-section-quasi-coherent",
      "parent_tag": "02BP",
      "suggested_batch": "desirables-02BP",
      "suggested_unit_file": "translation-data/units/desirables-02BP.jsonl",
      "unit_files": [],
      "state": "UNPREPARED"
    },
    {
      "ordinal": 14,
      "source_title": "Flat and smooth",
      "source_label": "desirables-section-flat-smooth",
      "parent_tag": "02BR",
      "suggested_batch": "desirables-02BR",
      "suggested_unit_file": "translation-data/units/desirables-02BR.jsonl",
      "unit_files": [],
      "state": "UNPREPARED"
    },
    {
      "ordinal": 15,
      "source_title": "Artin's representability theorem",
      "source_label": "desirables-section-representability",
      "parent_tag": "02BS",
      "suggested_batch": "desirables-02BS",
      "suggested_unit_file": "translation-data/units/desirables-02BS.jsonl",
      "unit_files": [],
      "state": "UNPREPARED"
    },
    {
      "ordinal": 16,
      "source_title": "DM stacks are finitely covered by schemes",
      "source_label": "desirables-section-dm-finite-cover",
      "parent_tag": "02BT",
      "suggested_batch": "desirables-02BT",
      "suggested_unit_file": "translation-data/units/desirables-02BT.jsonl",
      "unit_files": [],
      "state": "UNPREPARED"
    },
    {
      "ordinal": 17,
      "source_title": "Martin Olsson's paper on properness",
      "source_label": "desirables-section-proper-parametrization",
      "parent_tag": "02BU",
      "suggested_batch": "desirables-02BU",
      "suggested_unit_file": "translation-data/units/desirables-02BU.jsonl",
      "unit_files": [],
      "state": "UNPREPARED"
    },
    {
      "ordinal": 18,
      "source_title": "Proper pushforward of coherent sheaves",
      "source_label": "desirables-section-proper-pushforward",
      "parent_tag": "02BV",
      "suggested_batch": "desirables-02BV",
      "suggested_unit_file": "translation-data/units/desirables-02BV.jsonl",
      "unit_files": [],
      "state": "UNPREPARED"
    },
    {
      "ordinal": 19,
      "source_title": "Keel and Mori",
      "source_label": "desirables-section-keel-mori",
      "parent_tag": "02BW",
      "suggested_batch": "desirables-02BW",
      "suggested_unit_file": "translation-data/units/desirables-02BW.jsonl",
      "unit_files": [],
      "state": "UNPREPARED"
    },
    {
      "ordinal": 20,
      "source_title": "Add more here",
      "source_label": "desirables-section-add-more",
      "parent_tag": "02BX",
      "suggested_batch": "desirables-02BX",
      "suggested_unit_file": "translation-data/units/desirables-02BX.jsonl",
      "unit_files": [],
      "state": "UNPREPARED"
    }
  ]
}
