{
  "schema_version": 1,
  "generator_version": "chapter-templates-v1",
  "source_commit": "a04446e57ec1fbc252a871afcec7752fb2807b14",
  "chapter": "spaces-topologies",
  "chapter_ordinal": 73,
  "source_title": "Topologies on Algebraic Spaces",
  "source_file": "spaces-topologies.tex",
  "source_sha256": "sha256:c5bae429f5f620dd1fc96c5785a8f6bb8fe1fd0703b2bec8dd47cacfe3a8ac40",
  "source_state": "CURRENT",
  "sections": [
    {
      "ordinal": 1,
      "source_title": "Introduction",
      "source_label": "spaces-topologies-section-introduction",
      "parent_tag": "03Y5",
      "suggested_batch": "spaces-topologies-03Y5",
      "suggested_unit_file": "translation-data/units/spaces-topologies-03Y5.jsonl",
      "unit_files": [],
      "state": "UNPREPARED"
    },
    {
      "ordinal": 2,
      "source_title": "The general procedure",
      "source_label": "spaces-topologies-section-procedure",
      "parent_tag": "03Y6",
      "suggested_batch": "spaces-topologies-03Y6",
      "suggested_unit_file": "translation-data/units/spaces-topologies-03Y6.jsonl",
      "unit_files": [],
      "state": "UNPREPARED"
    },
    {
      "ordinal": 3,
      "source_title": "Zariski topology",
      "source_label": "spaces-topologies-section-zariski",
      "parent_tag": "03YD",
      "suggested_batch": "spaces-topologies-03YD",
      "suggested_unit_file": "translation-data/units/spaces-topologies-03YD.jsonl",
      "unit_files": [],
      "state": "UNPREPARED"
    },
    {
      "ordinal": 4,
      "source_title": "\\'Etale topology",
      "source_label": "spaces-topologies-section-etale",
      "parent_tag": "03YC",
      "suggested_batch": "spaces-topologies-03YC",
      "suggested_unit_file": "translation-data/units/spaces-topologies-03YC.jsonl",
      "unit_files": [],
      "state": "UNPREPARED"
    },
    {
      "ordinal": 5,
      "source_title": "Smooth topology",
      "source_label": "spaces-topologies-section-smooth",
      "parent_tag": "03YB",
      "suggested_batch": "spaces-topologies-03YB",
      "suggested_unit_file": "translation-data/units/spaces-topologies-03YB.jsonl",
      "unit_files": [],
      "state": "UNPREPARED"
    },
    {
      "ordinal": 6,
      "source_title": "Syntomic topology",
      "source_label": "spaces-topologies-section-syntomic",
      "parent_tag": "03YA",
      "suggested_batch": "spaces-topologies-03YA",
      "suggested_unit_file": "translation-data/units/spaces-topologies-03YA.jsonl",
      "unit_files": [],
      "state": "UNPREPARED"
    },
    {
      "ordinal": 7,
      "source_title": "Fppf topology",
      "source_label": "spaces-topologies-section-fppf",
      "parent_tag": "03Y7",
      "suggested_batch": "spaces-topologies-03Y7",
      "suggested_unit_file": "translation-data/units/spaces-topologies-03Y7.jsonl",
      "unit_files": [],
      "state": "UNPREPARED"
    },
    {
      "ordinal": 8,
      "source_title": "The ph topology",
      "source_label": "spaces-topologies-section-ph",
      "parent_tag": "0DFF",
      "suggested_batch": "spaces-topologies-0DFF",
      "suggested_unit_file": "translation-data/units/spaces-topologies-0DFF.jsonl",
      "unit_files": [],
      "state": "UNPREPARED"
    },
    {
      "ordinal": 9,
      "source_title": "Fpqc topology",
      "source_label": "spaces-topologies-section-fpqc",
      "parent_tag": "03MP",
      "suggested_batch": "spaces-topologies-03MP",
      "suggested_unit_file": "translation-data/units/spaces-topologies-03MP.jsonl",
      "unit_files": [],
      "state": "UNPREPARED"
    }
  ]
}
