{
  "schema_version": 1,
  "generator_version": "chapter-templates-v1",
  "source_commit": "a04446e57ec1fbc252a871afcec7752fb2807b14",
  "chapter": "brauer",
  "chapter_ordinal": 11,
  "source_title": "Brauer groups",
  "source_file": "brauer.tex",
  "source_sha256": "sha256:b2504820d769ebe4e9e33b8add78753fb30aca6e8a7f75c8d54dda885edcd682",
  "source_state": "CURRENT",
  "sections": [
    {
      "ordinal": 1,
      "source_title": "Introduction",
      "source_label": "brauer-section-introduction",
      "parent_tag": "073X",
      "suggested_batch": "brauer-073X",
      "suggested_unit_file": "translation-data/units/brauer-073X.jsonl",
      "unit_files": [],
      "state": "UNPREPARED"
    },
    {
      "ordinal": 2,
      "source_title": "Noncommutative algebras",
      "source_label": "brauer-section-algebras",
      "parent_tag": "073Y",
      "suggested_batch": "brauer-073Y",
      "suggested_unit_file": "translation-data/units/brauer-073Y.jsonl",
      "unit_files": [],
      "state": "UNPREPARED"
    },
    {
      "ordinal": 3,
      "source_title": "Wedderburn's theorem",
      "source_label": "brauer-section-wedderburn",
      "parent_tag": "0744",
      "suggested_batch": "brauer-0744",
      "suggested_unit_file": "translation-data/units/brauer-0744.jsonl",
      "unit_files": [],
      "state": "UNPREPARED"
    },
    {
      "ordinal": 4,
      "source_title": "Lemmas on algebras",
      "source_label": "brauer-section-lemmas",
      "parent_tag": "0748",
      "suggested_batch": "brauer-0748",
      "suggested_unit_file": "translation-data/units/brauer-0748.jsonl",
      "unit_files": [],
      "state": "UNPREPARED"
    },
    {
      "ordinal": 5,
      "source_title": "The Brauer group of a field",
      "source_label": "brauer-section-brauer",
      "parent_tag": "074J",
      "suggested_batch": "brauer-074J",
      "suggested_unit_file": "translation-data/units/brauer-074J.jsonl",
      "unit_files": [],
      "state": "UNPREPARED"
    },
    {
      "ordinal": 6,
      "source_title": "Skolem-Noether",
      "source_label": "brauer-section-skolem-noether",
      "parent_tag": "074P",
      "suggested_batch": "brauer-074P",
      "suggested_unit_file": "translation-data/units/brauer-074P.jsonl",
      "unit_files": [],
      "state": "UNPREPARED"
    },
    {
      "ordinal": 7,
      "source_title": "The centralizer theorem",
      "source_label": "brauer-section-centralizer",
      "parent_tag": "074S",
      "suggested_batch": "brauer-074S",
      "suggested_unit_file": "translation-data/units/brauer-074S.jsonl",
      "unit_files": [],
      "state": "UNPREPARED"
    },
    {
      "ordinal": 8,
      "source_title": "Splitting fields",
      "source_label": "brauer-section-splitting",
      "parent_tag": "074X",
      "suggested_batch": "brauer-074X",
      "suggested_unit_file": "translation-data/units/brauer-074X.jsonl",
      "unit_files": [],
      "state": "UNPREPARED"
    }
  ]
}
