{
  "schema_version": 1,
  "generator_version": "chapter-templates-v1",
  "source_commit": "a04446e57ec1fbc252a871afcec7752fb2807b14",
  "chapter": "stacks-geometry",
  "chapter_ordinal": 107,
  "source_title": "The Geometry of Algebraic Stacks",
  "source_file": "stacks-geometry.tex",
  "source_sha256": "sha256:d7bebc09039e656ebcad46293a30295603583f63a18d64f507d805c9cc7f4243",
  "source_state": "CURRENT",
  "sections": [
    {
      "ordinal": 1,
      "source_title": "Introduction",
      "source_label": "stacks-geometry-section-introduction",
      "parent_tag": "0DQS",
      "suggested_batch": "stacks-geometry-0DQS",
      "suggested_unit_file": "translation-data/units/stacks-geometry-0DQS.jsonl",
      "unit_files": [],
      "state": "UNPREPARED"
    },
    {
      "ordinal": 2,
      "source_title": "Versal rings",
      "source_label": "stacks-geometry-section-versal",
      "parent_tag": "0DQT",
      "suggested_batch": "stacks-geometry-0DQT",
      "suggested_unit_file": "translation-data/units/stacks-geometry-0DQT.jsonl",
      "unit_files": [],
      "state": "UNPREPARED"
    },
    {
      "ordinal": 3,
      "source_title": "Multiplicities of components of algebraic stacks",
      "source_label": "stacks-geometry-section-multiplicities",
      "parent_tag": "0DR4",
      "suggested_batch": "stacks-geometry-0DR4",
      "suggested_unit_file": "translation-data/units/stacks-geometry-0DR4.jsonl",
      "unit_files": [],
      "state": "UNPREPARED"
    },
    {
      "ordinal": 4,
      "source_title": "Formal branches and multiplicities",
      "source_label": "stacks-geometry-section-formal-branches",
      "parent_tag": "0DR9",
      "suggested_batch": "stacks-geometry-0DR9",
      "suggested_unit_file": "translation-data/units/stacks-geometry-0DR9.jsonl",
      "unit_files": [],
      "state": "UNPREPARED"
    },
    {
      "ordinal": 5,
      "source_title": "Dimension theory of algebraic stacks",
      "source_label": "stacks-geometry-section-dimension-of-algebraic-stacks",
      "parent_tag": "0DRE",
      "suggested_batch": "stacks-geometry-0DRE",
      "suggested_unit_file": "translation-data/units/stacks-geometry-0DRE.jsonl",
      "unit_files": [],
      "state": "UNPREPARED"
    },
    {
      "ordinal": 6,
      "source_title": "The dimension of the local ring",
      "source_label": "stacks-geometry-section-dimension-local-ring",
      "parent_tag": "0DS7",
      "suggested_batch": "stacks-geometry-0DS7",
      "suggested_unit_file": "translation-data/units/stacks-geometry-0DS7.jsonl",
      "unit_files": [],
      "state": "UNPREPARED"
    }
  ]
}
