{
  "schema_version": 1,
  "generator_version": "chapter-templates-v1",
  "source_commit": "a04446e57ec1fbc252a871afcec7752fb2807b14",
  "chapter": "etale",
  "chapter_ordinal": 41,
  "source_title": "\\'Etale Morphisms of Schemes",
  "source_file": "etale.tex",
  "source_sha256": "sha256:a6ae8c181a9ad46949828e842eb978f554d99d50517490f6a356089e5e7d197f",
  "source_state": "CURRENT",
  "sections": [
    {
      "ordinal": 1,
      "source_title": "Introduction",
      "source_label": "etale-section-introduction",
      "parent_tag": "024K",
      "suggested_batch": "etale-024K",
      "suggested_unit_file": "translation-data/units/etale-024K.jsonl",
      "unit_files": [],
      "state": "UNPREPARED"
    },
    {
      "ordinal": 2,
      "source_title": "Conventions",
      "source_label": "etale-section-conventions",
      "parent_tag": "039F",
      "suggested_batch": "etale-039F",
      "suggested_unit_file": "translation-data/units/etale-039F.jsonl",
      "unit_files": [],
      "state": "UNPREPARED"
    },
    {
      "ordinal": 3,
      "source_title": "Unramified morphisms",
      "source_label": "etale-section-unramified-definition",
      "parent_tag": "024L",
      "suggested_batch": "etale-024L",
      "suggested_unit_file": "translation-data/units/etale-024L.jsonl",
      "unit_files": [],
      "state": "UNPREPARED"
    },
    {
      "ordinal": 4,
      "source_title": "Three other characterizations of unramified morphisms",
      "source_label": "etale-section-three-other",
      "parent_tag": "024O",
      "suggested_batch": "etale-024O",
      "suggested_unit_file": "translation-data/units/etale-024O.jsonl",
      "unit_files": [],
      "state": "UNPREPARED"
    },
    {
      "ordinal": 5,
      "source_title": "The functorial characterization of unramified morphisms",
      "source_label": "etale-section-functorial-unramified",
      "parent_tag": "024Q",
      "suggested_batch": "etale-024Q",
      "suggested_unit_file": "translation-data/units/etale-024Q.jsonl",
      "unit_files": [],
      "state": "UNPREPARED"
    },
    {
      "ordinal": 6,
      "source_title": "Topological properties of unramified morphisms",
      "source_label": "etale-section-topological-unramified",
      "parent_tag": "024S",
      "suggested_batch": "etale-024S",
      "suggested_unit_file": "translation-data/units/etale-024S.jsonl",
      "unit_files": [],
      "state": "UNPREPARED"
    },
    {
      "ordinal": 7,
      "source_title": "Universally injective, unramified morphisms",
      "source_label": "etale-section-universally-injective-unramified",
      "parent_tag": "06ND",
      "suggested_batch": "etale-06ND",
      "suggested_unit_file": "translation-data/units/etale-06ND.jsonl",
      "unit_files": [],
      "state": "UNPREPARED"
    },
    {
      "ordinal": 8,
      "source_title": "Examples of unramified morphisms",
      "source_label": "etale-section-examples",
      "parent_tag": "024W",
      "suggested_batch": "etale-024W",
      "suggested_unit_file": "translation-data/units/etale-024W.jsonl",
      "unit_files": [],
      "state": "UNPREPARED"
    },
    {
      "ordinal": 9,
      "source_title": "Flat morphisms",
      "source_label": "etale-section-flat-morphisms",
      "parent_tag": "0250",
      "suggested_batch": "etale-0250",
      "suggested_unit_file": "translation-data/units/etale-0250.jsonl",
      "unit_files": [],
      "state": "UNPREPARED"
    },
    {
      "ordinal": 10,
      "source_title": "Topological properties of flat morphisms",
      "source_label": "etale-section-topological-flat",
      "parent_tag": "0254",
      "suggested_batch": "etale-0254",
      "suggested_unit_file": "translation-data/units/etale-0254.jsonl",
      "unit_files": [],
      "state": "UNPREPARED"
    },
    {
      "ordinal": 11,
      "source_title": "\\'Etale morphisms",
      "source_label": "etale-section-etale-morphisms",
      "parent_tag": "0257",
      "suggested_batch": "etale-0257",
      "suggested_unit_file": "translation-data/units/etale-0257.jsonl",
      "unit_files": [],
      "state": "UNPREPARED"
    },
    {
      "ordinal": 12,
      "source_title": "The structure theorem",
      "source_label": "etale-section-structure-etale-map",
      "parent_tag": "025A",
      "suggested_batch": "etale-025A",
      "suggested_unit_file": "translation-data/units/etale-025A.jsonl",
      "unit_files": [],
      "state": "UNPREPARED"
    },
    {
      "ordinal": 13,
      "source_title": "\\'Etale and smooth morphisms",
      "source_label": "etale-section-etale-smooth",
      "parent_tag": "039P",
      "suggested_batch": "etale-039P",
      "suggested_unit_file": "translation-data/units/etale-039P.jsonl",
      "unit_files": [],
      "state": "UNPREPARED"
    },
    {
      "ordinal": 14,
      "source_title": "Topological properties of \\'etale morphisms",
      "source_label": "etale-section-topological-etale",
      "parent_tag": "025F",
      "suggested_batch": "etale-025F",
      "suggested_unit_file": "translation-data/units/etale-025F.jsonl",
      "unit_files": [],
      "state": "UNPREPARED"
    },
    {
      "ordinal": 15,
      "source_title": "Topological invariance of the \\'etale topology",
      "source_label": "etale-section-topological-invariance",
      "parent_tag": "06NE",
      "suggested_batch": "etale-06NE",
      "suggested_unit_file": "translation-data/units/etale-06NE.jsonl",
      "unit_files": [],
      "state": "UNPREPARED"
    },
    {
      "ordinal": 16,
      "source_title": "The functorial characterization",
      "source_label": "etale-section-functorial-etale",
      "parent_tag": "025J",
      "suggested_batch": "etale-025J",
      "suggested_unit_file": "translation-data/units/etale-025J.jsonl",
      "unit_files": [],
      "state": "UNPREPARED"
    },
    {
      "ordinal": 17,
      "source_title": "\\'Etale local structure of unramified morphisms",
      "source_label": "etale-section-unramified-etale-local",
      "parent_tag": "04HG",
      "suggested_batch": "etale-04HG",
      "suggested_unit_file": "translation-data/units/etale-04HG.jsonl",
      "unit_files": [],
      "state": "UNPREPARED"
    },
    {
      "ordinal": 18,
      "source_title": "\\'Etale local structure of \\'etale morphisms",
      "source_label": "etale-section-etale-local-etale",
      "parent_tag": "04HK",
      "suggested_batch": "etale-04HK",
      "suggested_unit_file": "translation-data/units/etale-04HK.jsonl",
      "unit_files": [],
      "state": "UNPREPARED"
    },
    {
      "ordinal": 19,
      "source_title": "Permanence properties",
      "source_label": "etale-section-properties-permanence",
      "parent_tag": "025L",
      "suggested_batch": "etale-025L",
      "suggested_unit_file": "translation-data/units/etale-025L.jsonl",
      "unit_files": [],
      "state": "UNPREPARED"
    },
    {
      "ordinal": 20,
      "source_title": "Descending \\'etale morphisms",
      "source_label": "etale-section-descending-etale",
      "parent_tag": "0BTH",
      "suggested_batch": "etale-0BTH",
      "suggested_unit_file": "translation-data/units/etale-0BTH.jsonl",
      "unit_files": [],
      "state": "UNPREPARED"
    },
    {
      "ordinal": 21,
      "source_title": "Normal crossings divisors",
      "source_label": "etale-section-normal-crossings",
      "parent_tag": "0CBN",
      "suggested_batch": "etale-0CBN",
      "suggested_unit_file": "translation-data/units/etale-0CBN.jsonl",
      "unit_files": [],
      "state": "UNPREPARED"
    }
  ]
}
