{
  "schema_version": 1,
  "generator_version": "chapter-templates-v1",
  "source_commit": "a04446e57ec1fbc252a871afcec7752fb2807b14",
  "chapter": "adequate",
  "chapter_ordinal": 46,
  "source_title": "Adequate Modules",
  "source_file": "adequate.tex",
  "source_sha256": "sha256:f185d78d5d401b9e157dc3972c1366155823ce4a212fbb9b68901c8aacbe91ad",
  "source_state": "CURRENT",
  "sections": [
    {
      "ordinal": 1,
      "source_title": "Introduction",
      "source_label": "adequate-section-introduction",
      "parent_tag": "06Z2",
      "suggested_batch": "adequate-06Z2",
      "suggested_unit_file": "translation-data/units/adequate-06Z2.jsonl",
      "unit_files": [],
      "state": "UNPREPARED"
    },
    {
      "ordinal": 2,
      "source_title": "Conventions",
      "source_label": "adequate-section-conventions",
      "parent_tag": "06Z3",
      "suggested_batch": "adequate-06Z3",
      "suggested_unit_file": "translation-data/units/adequate-06Z3.jsonl",
      "unit_files": [],
      "state": "UNPREPARED"
    },
    {
      "ordinal": 3,
      "source_title": "Adequate functors",
      "source_label": "adequate-section-quasi-coherent",
      "parent_tag": "06US",
      "suggested_batch": "adequate-06US",
      "suggested_unit_file": "translation-data/units/adequate-06US.jsonl",
      "unit_files": [],
      "state": "UNPREPARED"
    },
    {
      "ordinal": 4,
      "source_title": "Higher exts of adequate functors",
      "source_label": "adequate-section-higher-ext",
      "parent_tag": "06Z5",
      "suggested_batch": "adequate-06Z5",
      "suggested_unit_file": "translation-data/units/adequate-06Z5.jsonl",
      "unit_files": [],
      "state": "UNPREPARED"
    },
    {
      "ordinal": 5,
      "source_title": "Adequate modules",
      "source_label": "adequate-section-adequate",
      "parent_tag": "06VF",
      "suggested_batch": "adequate-06VF",
      "suggested_unit_file": "translation-data/units/adequate-06VF.jsonl",
      "unit_files": [],
      "state": "UNPREPARED"
    },
    {
      "ordinal": 6,
      "source_title": "Parasitic adequate modules",
      "source_label": "adequate-section-parasitic",
      "parent_tag": "06ZK",
      "suggested_batch": "adequate-06ZK",
      "suggested_unit_file": "translation-data/units/adequate-06ZK.jsonl",
      "unit_files": [],
      "state": "UNPREPARED"
    },
    {
      "ordinal": 7,
      "source_title": "Derived categories of adequate modules, I",
      "source_label": "adequate-section-comparison",
      "parent_tag": "06VS",
      "suggested_batch": "adequate-06VS",
      "suggested_unit_file": "translation-data/units/adequate-06VS.jsonl",
      "unit_files": [],
      "state": "UNPREPARED"
    },
    {
      "ordinal": 8,
      "source_title": "Pure extensions",
      "source_label": "adequate-section-pure",
      "parent_tag": "06ZX",
      "suggested_batch": "adequate-06ZX",
      "suggested_unit_file": "translation-data/units/adequate-06ZX.jsonl",
      "unit_files": [],
      "state": "UNPREPARED"
    },
    {
      "ordinal": 9,
      "source_title": "Higher exts of quasi-coherent sheaves on the big site",
      "source_label": "adequate-section-big",
      "parent_tag": "0707",
      "suggested_batch": "adequate-0707",
      "suggested_unit_file": "translation-data/units/adequate-0707.jsonl",
      "unit_files": [],
      "state": "UNPREPARED"
    },
    {
      "ordinal": 10,
      "source_title": "Derived categories of adequate modules, II",
      "source_label": "adequate-section-derived-categories",
      "parent_tag": "070T",
      "suggested_batch": "adequate-070T",
      "suggested_unit_file": "translation-data/units/adequate-070T.jsonl",
      "unit_files": [],
      "state": "UNPREPARED"
    }
  ]
}
