{
  "schema_version": 1,
  "generator_version": "chapter-templates-v1",
  "source_commit": "a04446e57ec1fbc252a871afcec7752fb2807b14",
  "chapter": "hypercovering",
  "chapter_ordinal": 25,
  "source_title": "Hypercoverings",
  "source_file": "hypercovering.tex",
  "source_sha256": "sha256:b90f9152c608a6a725924549de093a810a8169499ba31c86967582da498a666e",
  "source_state": "CURRENT",
  "sections": [
    {
      "ordinal": 1,
      "source_title": "Introduction",
      "source_label": "hypercovering-section-introduction",
      "parent_tag": "01FY",
      "suggested_batch": "hypercovering-01FY",
      "suggested_unit_file": "translation-data/units/hypercovering-01FY.jsonl",
      "unit_files": [],
      "state": "UNPREPARED"
    },
    {
      "ordinal": 2,
      "source_title": "Semi-representable objects",
      "source_label": "hypercovering-section-semi-representable",
      "parent_tag": "0DBB",
      "suggested_batch": "hypercovering-0DBB",
      "suggested_unit_file": "translation-data/units/hypercovering-0DBB.jsonl",
      "unit_files": [],
      "state": "UNPREPARED"
    },
    {
      "ordinal": 3,
      "source_title": "Hypercoverings",
      "source_label": "hypercovering-section-hypercoverings",
      "parent_tag": "01FZ",
      "suggested_batch": "hypercovering-01FZ",
      "suggested_unit_file": "translation-data/units/hypercovering-01FZ.jsonl",
      "unit_files": [],
      "state": "UNPREPARED"
    },
    {
      "ordinal": 4,
      "source_title": "Acyclicity",
      "source_label": "hypercovering-section-acyclicity",
      "parent_tag": "01GA",
      "suggested_batch": "hypercovering-01GA",
      "suggested_unit_file": "translation-data/units/hypercovering-01GA.jsonl",
      "unit_files": [],
      "state": "UNPREPARED"
    },
    {
      "ordinal": 5,
      "source_title": "{\\v C}ech cohomology and hypercoverings",
      "source_label": "hypercovering-section-hyper-cech",
      "parent_tag": "01GU",
      "suggested_batch": "hypercovering-01GU",
      "suggested_unit_file": "translation-data/units/hypercovering-01GU.jsonl",
      "unit_files": [],
      "state": "UNPREPARED"
    },
    {
      "ordinal": 6,
      "source_title": "Hypercoverings a la Verdier",
      "source_label": "hypercovering-section-hypercoverings-verdier",
      "parent_tag": "09VT",
      "suggested_batch": "hypercovering-09VT",
      "suggested_unit_file": "translation-data/units/hypercovering-09VT.jsonl",
      "unit_files": [],
      "state": "UNPREPARED"
    },
    {
      "ordinal": 7,
      "source_title": "Covering hypercoverings",
      "source_label": "hypercovering-section-covering",
      "parent_tag": "01GG",
      "suggested_batch": "hypercovering-01GG",
      "suggested_unit_file": "translation-data/units/hypercovering-01GG.jsonl",
      "unit_files": [],
      "state": "UNPREPARED"
    },
    {
      "ordinal": 8,
      "source_title": "Adding simplices",
      "source_label": "hypercovering-section-adding-simplices",
      "parent_tag": "01GL",
      "suggested_batch": "hypercovering-01GL",
      "suggested_unit_file": "translation-data/units/hypercovering-01GL.jsonl",
      "unit_files": [],
      "state": "UNPREPARED"
    },
    {
      "ordinal": 9,
      "source_title": "Homotopies",
      "source_label": "hypercovering-section-homotopies",
      "parent_tag": "01GO",
      "suggested_batch": "hypercovering-01GO",
      "suggested_unit_file": "translation-data/units/hypercovering-01GO.jsonl",
      "unit_files": [],
      "state": "UNPREPARED"
    },
    {
      "ordinal": 10,
      "source_title": "Cohomology and hypercoverings",
      "source_label": "hypercovering-section-cohomology",
      "parent_tag": "01GZ",
      "suggested_batch": "hypercovering-01GZ",
      "suggested_unit_file": "translation-data/units/hypercovering-01GZ.jsonl",
      "unit_files": [],
      "state": "UNPREPARED"
    },
    {
      "ordinal": 11,
      "source_title": "Hypercoverings of spaces",
      "source_label": "hypercovering-section-hypercoverings-spaces",
      "parent_tag": "01H1",
      "suggested_batch": "hypercovering-01H1",
      "suggested_unit_file": "translation-data/units/hypercovering-01H1.jsonl",
      "unit_files": [],
      "state": "UNPREPARED"
    },
    {
      "ordinal": 12,
      "source_title": "Constructing hypercoverings",
      "source_label": "hypercovering-section-hypercovering-sites",
      "parent_tag": "094J",
      "suggested_batch": "hypercovering-094J",
      "suggested_unit_file": "translation-data/units/hypercovering-094J.jsonl",
      "unit_files": [],
      "state": "UNPREPARED"
    }
  ]
}
