{
  "schema_version": 1,
  "generator_version": "chapter-templates-v1",
  "source_commit": "a04446e57ec1fbc252a871afcec7752fb2807b14",
  "chapter": "derham",
  "chapter_ordinal": 50,
  "source_title": "de Rham Cohomology",
  "source_file": "derham.tex",
  "source_sha256": "sha256:2dc4e936fce0e3b2729f9d9b68d4ff5e6f188f1c25f6723d61b92fa682e90fc8",
  "source_state": "CURRENT",
  "sections": [
    {
      "ordinal": 1,
      "source_title": "Introduction",
      "source_label": "derham-section-introduction",
      "parent_tag": "0FK5",
      "suggested_batch": "derham-0FK5",
      "suggested_unit_file": "translation-data/units/derham-0FK5.jsonl",
      "unit_files": [],
      "state": "UNPREPARED"
    },
    {
      "ordinal": 2,
      "source_title": "The de Rham complex",
      "source_label": "derham-section-de-rham-complex",
      "parent_tag": "07HX",
      "suggested_batch": "derham-07HX",
      "suggested_unit_file": "translation-data/units/derham-07HX.jsonl",
      "unit_files": [],
      "state": "UNPREPARED"
    },
    {
      "ordinal": 3,
      "source_title": "de Rham cohomology",
      "source_label": "derham-section-de-rham-cohomology",
      "parent_tag": "0FL6",
      "suggested_batch": "derham-0FL6",
      "suggested_unit_file": "translation-data/units/derham-0FL6.jsonl",
      "unit_files": [],
      "state": "UNPREPARED"
    },
    {
      "ordinal": 4,
      "source_title": "Cup product",
      "source_label": "derham-section-cup-product",
      "parent_tag": "0FM1",
      "suggested_batch": "derham-0FM1",
      "suggested_unit_file": "translation-data/units/derham-0FM1.jsonl",
      "unit_files": [],
      "state": "UNPREPARED"
    },
    {
      "ordinal": 5,
      "source_title": "Hodge cohomology",
      "source_label": "derham-section-hodge-cohomology",
      "parent_tag": "0FM4",
      "suggested_batch": "derham-0FM4",
      "suggested_unit_file": "translation-data/units/derham-0FM4.jsonl",
      "unit_files": [],
      "state": "UNPREPARED"
    },
    {
      "ordinal": 6,
      "source_title": "Two spectral sequences",
      "source_label": "derham-section-hodge-to-de-rham",
      "parent_tag": "0FM6",
      "suggested_batch": "derham-0FM6",
      "suggested_unit_file": "translation-data/units/derham-0FM6.jsonl",
      "unit_files": [],
      "state": "UNPREPARED"
    },
    {
      "ordinal": 7,
      "source_title": "The Hodge filtration",
      "source_label": "derham-section-hodge-filtration",
      "parent_tag": "0FM7",
      "suggested_batch": "derham-0FM7",
      "suggested_unit_file": "translation-data/units/derham-0FM7.jsonl",
      "unit_files": [],
      "state": "UNPREPARED"
    },
    {
      "ordinal": 8,
      "source_title": "K\\\"unneth formula",
      "source_label": "derham-section-kunneth",
      "parent_tag": "0FM9",
      "suggested_batch": "derham-0FM9",
      "suggested_unit_file": "translation-data/units/derham-0FM9.jsonl",
      "unit_files": [],
      "state": "UNPREPARED"
    },
    {
      "ordinal": 9,
      "source_title": "First Chern class in de Rham cohomology",
      "source_label": "derham-section-first-chern-class",
      "parent_tag": "0FLE",
      "suggested_batch": "derham-0FLE",
      "suggested_unit_file": "translation-data/units/derham-0FLE.jsonl",
      "unit_files": [],
      "state": "UNPREPARED"
    },
    {
      "ordinal": 10,
      "source_title": "de Rham cohomology of a line bundle",
      "source_label": "derham-section-line-bundle",
      "parent_tag": "0FU8",
      "suggested_batch": "derham-0FU8",
      "suggested_unit_file": "translation-data/units/derham-0FU8.jsonl",
      "unit_files": [],
      "state": "UNPREPARED"
    },
    {
      "ordinal": 11,
      "source_title": "de Rham cohomology of projective space",
      "source_label": "derham-section-projective-space",
      "parent_tag": "0FMG",
      "suggested_batch": "derham-0FMG",
      "suggested_unit_file": "translation-data/units/derham-0FMG.jsonl",
      "unit_files": [],
      "state": "UNPREPARED"
    },
    {
      "ordinal": 12,
      "source_title": "The spectral sequence for a smooth morphism",
      "source_label": "derham-section-relative-spectral-sequence",
      "parent_tag": "0FMK",
      "suggested_batch": "derham-0FMK",
      "suggested_unit_file": "translation-data/units/derham-0FMK.jsonl",
      "unit_files": [],
      "state": "UNPREPARED"
    },
    {
      "ordinal": 13,
      "source_title": "Leray-Hirsch type theorems",
      "source_label": "derham-section-leray-hirsch",
      "parent_tag": "0FUL",
      "suggested_batch": "derham-0FUL",
      "suggested_unit_file": "translation-data/units/derham-0FUL.jsonl",
      "unit_files": [],
      "state": "UNPREPARED"
    },
    {
      "ordinal": 14,
      "source_title": "Projective space bundle formula",
      "source_label": "derham-section-projective-space-bundle-formula",
      "parent_tag": "0FMS",
      "suggested_batch": "derham-0FMS",
      "suggested_unit_file": "translation-data/units/derham-0FMS.jsonl",
      "unit_files": [],
      "state": "UNPREPARED"
    },
    {
      "ordinal": 15,
      "source_title": "Log poles along a divisor",
      "source_label": "derham-section-divisor",
      "parent_tag": "0FMU",
      "suggested_batch": "derham-0FMU",
      "suggested_unit_file": "translation-data/units/derham-0FMU.jsonl",
      "unit_files": [],
      "state": "UNPREPARED"
    },
    {
      "ordinal": 16,
      "source_title": "Calculations",
      "source_label": "derham-section-calculations",
      "parent_tag": "0FUB",
      "suggested_batch": "derham-0FUB",
      "suggested_unit_file": "translation-data/units/derham-0FUB.jsonl",
      "unit_files": [],
      "state": "UNPREPARED"
    },
    {
      "ordinal": 17,
      "source_title": "Blowing up and de Rham cohomology",
      "source_label": "derham-section-blowing-up",
      "parent_tag": "0FUC",
      "suggested_batch": "derham-0FUC",
      "suggested_unit_file": "translation-data/units/derham-0FUC.jsonl",
      "unit_files": [],
      "state": "UNPREPARED"
    },
    {
      "ordinal": 18,
      "source_title": "Comparing sheaves of differential forms",
      "source_label": "derham-section-quasi-finite-syntomic",
      "parent_tag": "0FL7",
      "suggested_batch": "derham-0FL7",
      "suggested_unit_file": "translation-data/units/derham-0FL7.jsonl",
      "unit_files": [],
      "state": "UNPREPARED"
    },
    {
      "ordinal": 19,
      "source_title": "Trace maps on de Rham complexes",
      "source_label": "derham-section-trace",
      "parent_tag": "0FK6",
      "suggested_batch": "derham-0FK6",
      "suggested_unit_file": "translation-data/units/derham-0FK6.jsonl",
      "unit_files": [],
      "state": "UNPREPARED"
    },
    {
      "ordinal": 20,
      "source_title": "Poincar\\'e duality",
      "source_label": "derham-section-poincare-duality",
      "parent_tag": "0FW3",
      "suggested_batch": "derham-0FW3",
      "suggested_unit_file": "translation-data/units/derham-0FW3.jsonl",
      "unit_files": [],
      "state": "UNPREPARED"
    },
    {
      "ordinal": 21,
      "source_title": "Chern classes",
      "source_label": "derham-section-chern-classes",
      "parent_tag": "0FW8",
      "suggested_batch": "derham-0FW8",
      "suggested_unit_file": "translation-data/units/derham-0FW8.jsonl",
      "unit_files": [],
      "state": "UNPREPARED"
    },
    {
      "ordinal": 22,
      "source_title": "A Weil cohomology theory",
      "source_label": "derham-section-weil",
      "parent_tag": "0FWC",
      "suggested_batch": "derham-0FWC",
      "suggested_unit_file": "translation-data/units/derham-0FWC.jsonl",
      "unit_files": [],
      "state": "UNPREPARED"
    },
    {
      "ordinal": 23,
      "source_title": "Gysin maps for closed immersions",
      "source_label": "derham-section-gysin",
      "parent_tag": "0G82",
      "suggested_batch": "derham-0G82",
      "suggested_unit_file": "translation-data/units/derham-0G82.jsonl",
      "unit_files": [],
      "state": "UNPREPARED"
    },
    {
      "ordinal": 24,
      "source_title": "Relative Poincar\\'e duality",
      "source_label": "derham-section-relative-poincare-duality",
      "parent_tag": "0G8F",
      "suggested_batch": "derham-0G8F",
      "suggested_unit_file": "translation-data/units/derham-0G8F.jsonl",
      "unit_files": [],
      "state": "UNPREPARED"
    }
  ]
}
