{
  "schema_version": 1,
  "generator_version": "chapter-templates-v1",
  "source_commit": "a04446e57ec1fbc252a871afcec7752fb2807b14",
  "chapter": "stacks-more-morphisms",
  "chapter_ordinal": 106,
  "source_title": "More on Morphisms of Stacks",
  "source_file": "stacks-more-morphisms.tex",
  "source_sha256": "sha256:d9d6c4bdfe5a21f2cb7e10f60dae9f7e3b17018f1bdeb5046d0a7d785d5fae9c",
  "source_state": "CURRENT",
  "sections": [
    {
      "ordinal": 1,
      "source_title": "Introduction",
      "source_label": "stacks-more-morphisms-section-introduction",
      "parent_tag": "0BPL",
      "suggested_batch": "stacks-more-morphisms-0BPL",
      "suggested_unit_file": "translation-data/units/stacks-more-morphisms-0BPL.jsonl",
      "unit_files": [],
      "state": "UNPREPARED"
    },
    {
      "ordinal": 2,
      "source_title": "Conventions and abuse of language",
      "source_label": "stacks-more-morphisms-section-conventions",
      "parent_tag": "0BPM",
      "suggested_batch": "stacks-more-morphisms-0BPM",
      "suggested_unit_file": "translation-data/units/stacks-more-morphisms-0BPM.jsonl",
      "unit_files": [],
      "state": "UNPREPARED"
    },
    {
      "ordinal": 3,
      "source_title": "Thickenings",
      "source_label": "stacks-more-morphisms-section-thickenings",
      "parent_tag": "0BPN",
      "suggested_batch": "stacks-more-morphisms-0BPN",
      "suggested_unit_file": "translation-data/units/stacks-more-morphisms-0BPN.jsonl",
      "unit_files": [],
      "state": "UNPREPARED"
    },
    {
      "ordinal": 4,
      "source_title": "Morphisms of thickenings",
      "source_label": "stacks-more-morphisms-section-morphisms-thickenings",
      "parent_tag": "0CJ8",
      "suggested_batch": "stacks-more-morphisms-0CJ8",
      "suggested_unit_file": "translation-data/units/stacks-more-morphisms-0CJ8.jsonl",
      "unit_files": [],
      "state": "UNPREPARED"
    },
    {
      "ordinal": 5,
      "source_title": "Infinitesimal deformations of algebraic stacks",
      "source_label": "stacks-more-morphisms-section-deform",
      "parent_tag": "0CJA",
      "suggested_batch": "stacks-more-morphisms-0CJA",
      "suggested_unit_file": "translation-data/units/stacks-more-morphisms-0CJA.jsonl",
      "unit_files": [],
      "state": "UNPREPARED"
    },
    {
      "ordinal": 6,
      "source_title": "Lifting affines",
      "source_label": "stacks-more-morphisms-section-lifting-affines",
      "parent_tag": "0CJN",
      "suggested_batch": "stacks-more-morphisms-0CJN",
      "suggested_unit_file": "translation-data/units/stacks-more-morphisms-0CJN.jsonl",
      "unit_files": [],
      "state": "UNPREPARED"
    },
    {
      "ordinal": 7,
      "source_title": "Infinitesimal deformations",
      "source_label": "stacks-more-morphisms-section-inf",
      "parent_tag": "0DNQ",
      "suggested_batch": "stacks-more-morphisms-0DNQ",
      "suggested_unit_file": "translation-data/units/stacks-more-morphisms-0DNQ.jsonl",
      "unit_files": [],
      "state": "UNPREPARED"
    },
    {
      "ordinal": 8,
      "source_title": "Formally smooth morphisms",
      "source_label": "stacks-more-morphisms-section-formally-smooth",
      "parent_tag": "0DNV",
      "suggested_batch": "stacks-more-morphisms-0DNV",
      "suggested_unit_file": "translation-data/units/stacks-more-morphisms-0DNV.jsonl",
      "unit_files": [],
      "state": "UNPREPARED"
    },
    {
      "ordinal": 9,
      "source_title": "Blowing up and flatness",
      "source_label": "stacks-more-morphisms-section-blowup-flat",
      "parent_tag": "0CQ3",
      "suggested_batch": "stacks-more-morphisms-0CQ3",
      "suggested_unit_file": "translation-data/units/stacks-more-morphisms-0CQ3.jsonl",
      "unit_files": [],
      "state": "UNPREPARED"
    },
    {
      "ordinal": 10,
      "source_title": "Chow's lemma for algebraic stacks",
      "source_label": "stacks-more-morphisms-section-chow",
      "parent_tag": "0CQ5",
      "suggested_batch": "stacks-more-morphisms-0CQ5",
      "suggested_unit_file": "translation-data/units/stacks-more-morphisms-0CQ5.jsonl",
      "unit_files": [],
      "state": "UNPREPARED"
    },
    {
      "ordinal": 11,
      "source_title": "Noetherian valuative criterion",
      "source_label": "stacks-more-morphisms-section-Noetherian-valuative-criterion",
      "parent_tag": "0CQL",
      "suggested_batch": "stacks-more-morphisms-0CQL",
      "suggested_unit_file": "translation-data/units/stacks-more-morphisms-0CQL.jsonl",
      "unit_files": [],
      "state": "UNPREPARED"
    },
    {
      "ordinal": 12,
      "source_title": "Moduli spaces",
      "source_label": "stacks-more-morphisms-section-moduli-spaces",
      "parent_tag": "0DUF",
      "suggested_batch": "stacks-more-morphisms-0DUF",
      "suggested_unit_file": "translation-data/units/stacks-more-morphisms-0DUF.jsonl",
      "unit_files": [],
      "state": "UNPREPARED"
    },
    {
      "ordinal": 13,
      "source_title": "The Keel-Mori theorem",
      "source_label": "stacks-more-morphisms-section-Keel-Mori",
      "parent_tag": "0DUK",
      "suggested_batch": "stacks-more-morphisms-0DUK",
      "suggested_unit_file": "translation-data/units/stacks-more-morphisms-0DUK.jsonl",
      "unit_files": [],
      "state": "UNPREPARED"
    },
    {
      "ordinal": 14,
      "source_title": "Properties of moduli spaces",
      "source_label": "stacks-more-morphisms-section-properties-moduli-spaces",
      "parent_tag": "0DUW",
      "suggested_batch": "stacks-more-morphisms-0DUW",
      "suggested_unit_file": "translation-data/units/stacks-more-morphisms-0DUW.jsonl",
      "unit_files": [],
      "state": "UNPREPARED"
    },
    {
      "ordinal": 15,
      "source_title": "Stacks and fpqc coverings",
      "source_label": "stacks-more-morphisms-section-fpqc",
      "parent_tag": "0GRG",
      "suggested_batch": "stacks-more-morphisms-0GRG",
      "suggested_unit_file": "translation-data/units/stacks-more-morphisms-0GRG.jsonl",
      "unit_files": [],
      "state": "UNPREPARED"
    },
    {
      "ordinal": 16,
      "source_title": "Tensor functors",
      "source_label": "stacks-more-morphisms-section-tensor-functors",
      "parent_tag": "0GRI",
      "suggested_batch": "stacks-more-morphisms-0GRI",
      "suggested_unit_file": "translation-data/units/stacks-more-morphisms-0GRI.jsonl",
      "unit_files": [],
      "state": "UNPREPARED"
    }
  ]
}
