{
  "schema_version": 1,
  "generator_version": "chapter-templates-v1",
  "source_commit": "a04446e57ec1fbc252a871afcec7752fb2807b14",
  "chapter": "resolve",
  "chapter_ordinal": 54,
  "source_title": "Resolution of Surfaces",
  "source_file": "resolve.tex",
  "source_sha256": "sha256:4cc743f7c82f9c3845bb8c91447cb7adc27bdc3305fc2036eeddf41469320554",
  "source_state": "CURRENT",
  "sections": [
    {
      "ordinal": 1,
      "source_title": "Introduction",
      "source_label": "resolve-section-introduction",
      "parent_tag": "0ADX",
      "suggested_batch": "resolve-0ADX",
      "suggested_unit_file": "translation-data/units/resolve-0ADX.jsonl",
      "unit_files": [],
      "state": "UNPREPARED"
    },
    {
      "ordinal": 2,
      "source_title": "A trace map in positive characteristic",
      "source_label": "resolve-section-trace",
      "parent_tag": "0ADY",
      "suggested_batch": "resolve-0ADY",
      "suggested_unit_file": "translation-data/units/resolve-0ADY.jsonl",
      "unit_files": [],
      "state": "UNPREPARED"
    },
    {
      "ordinal": 3,
      "source_title": "Quadratic transformations",
      "source_label": "resolve-section-quadratic",
      "parent_tag": "0AGP",
      "suggested_batch": "resolve-0AGP",
      "suggested_unit_file": "translation-data/units/resolve-0AGP.jsonl",
      "unit_files": [],
      "state": "UNPREPARED"
    },
    {
      "ordinal": 4,
      "source_title": "Dominating by quadratic transformations",
      "source_label": "resolve-section-dominating-by-quadratic",
      "parent_tag": "0BFS",
      "suggested_batch": "resolve-0BFS",
      "suggested_unit_file": "translation-data/units/resolve-0BFS.jsonl",
      "unit_files": [],
      "state": "UNPREPARED"
    },
    {
      "ordinal": 5,
      "source_title": "Dominating by normalized blowups",
      "source_label": "resolve-section-normalized-blowups",
      "parent_tag": "0BBR",
      "suggested_batch": "resolve-0BBR",
      "suggested_unit_file": "translation-data/units/resolve-0BBR.jsonl",
      "unit_files": [],
      "state": "UNPREPARED"
    },
    {
      "ordinal": 6,
      "source_title": "Modifying over local rings",
      "source_label": "resolve-section-modifications",
      "parent_tag": "0AE1",
      "suggested_batch": "resolve-0AE1",
      "suggested_unit_file": "translation-data/units/resolve-0AE1.jsonl",
      "unit_files": [],
      "state": "UNPREPARED"
    },
    {
      "ordinal": 7,
      "source_title": "Vanishing",
      "source_label": "resolve-section-vanishing",
      "parent_tag": "0AX7",
      "suggested_batch": "resolve-0AX7",
      "suggested_unit_file": "translation-data/units/resolve-0AX7.jsonl",
      "unit_files": [],
      "state": "UNPREPARED"
    },
    {
      "ordinal": 8,
      "source_title": "Boundedness",
      "source_label": "resolve-section-bounded",
      "parent_tag": "0AXE",
      "suggested_batch": "resolve-0AXE",
      "suggested_unit_file": "translation-data/units/resolve-0AXE.jsonl",
      "unit_files": [],
      "state": "UNPREPARED"
    },
    {
      "ordinal": 9,
      "source_title": "Rational singularities",
      "source_label": "resolve-section-rational-singularities",
      "parent_tag": "0B4V",
      "suggested_batch": "resolve-0B4V",
      "suggested_unit_file": "translation-data/units/resolve-0B4V.jsonl",
      "unit_files": [],
      "state": "UNPREPARED"
    },
    {
      "ordinal": 10,
      "source_title": "Formal arcs",
      "source_label": "resolve-section-arcs",
      "parent_tag": "0BG1",
      "suggested_batch": "resolve-0BG1",
      "suggested_unit_file": "translation-data/units/resolve-0BG1.jsonl",
      "unit_files": [],
      "state": "UNPREPARED"
    },
    {
      "ordinal": 11,
      "source_title": "Base change to the completion",
      "source_label": "resolve-section-aux",
      "parent_tag": "0BG4",
      "suggested_batch": "resolve-0BG4",
      "suggested_unit_file": "translation-data/units/resolve-0BG4.jsonl",
      "unit_files": [],
      "state": "UNPREPARED"
    },
    {
      "ordinal": 12,
      "source_title": "Rational double points",
      "source_label": "resolve-section-rational-double-points",
      "parent_tag": "0BGB",
      "suggested_batch": "resolve-0BGB",
      "suggested_unit_file": "translation-data/units/resolve-0BGB.jsonl",
      "unit_files": [],
      "state": "UNPREPARED"
    },
    {
      "ordinal": 13,
      "source_title": "Implied properties",
      "source_label": "resolve-section-existence-gives",
      "parent_tag": "0BGF",
      "suggested_batch": "resolve-0BGF",
      "suggested_unit_file": "translation-data/units/resolve-0BGF.jsonl",
      "unit_files": [],
      "state": "UNPREPARED"
    },
    {
      "ordinal": 14,
      "source_title": "Resolution",
      "source_label": "resolve-section-resolution",
      "parent_tag": "0BGJ",
      "suggested_batch": "resolve-0BGJ",
      "suggested_unit_file": "translation-data/units/resolve-0BGJ.jsonl",
      "unit_files": [],
      "state": "UNPREPARED"
    },
    {
      "ordinal": 15,
      "source_title": "Embedded resolution",
      "source_label": "resolve-section-embedded",
      "parent_tag": "0BI3",
      "suggested_batch": "resolve-0BI3",
      "suggested_unit_file": "translation-data/units/resolve-0BI3.jsonl",
      "unit_files": [],
      "state": "UNPREPARED"
    },
    {
      "ordinal": 16,
      "source_title": "Contracting exceptional curves",
      "source_label": "resolve-section-minus-one",
      "parent_tag": "0C2I",
      "suggested_batch": "resolve-0C2I",
      "suggested_unit_file": "translation-data/units/resolve-0C2I.jsonl",
      "unit_files": [],
      "state": "UNPREPARED"
    },
    {
      "ordinal": 17,
      "source_title": "Factorization birational maps",
      "source_label": "resolve-section-factorizing",
      "parent_tag": "0C5Q",
      "suggested_batch": "resolve-0C5Q",
      "suggested_unit_file": "translation-data/units/resolve-0C5Q.jsonl",
      "unit_files": [],
      "state": "UNPREPARED"
    }
  ]
}
